Genero,Edad,Procedencia,Calificacion,Score,Aportaciones,Titulo,Opinion,Pais,Idioma,Dispositivo,Fecha
femenino,60,internacional,Muy bueno,4,28,iconic,its a must see but in my opinion more due to its fame i was honestly not too impressed weve been to churches with far superior architecture in mexico im a lover of old spanish architecture so i expected it to be grander than it turned out to be however if you are visiting for religious reason it is totally worth your time,Estados Unidos,ingles,Móvil,2016-12-21
masculino,20,internacional,Excelente,5,79,una basilica brillante,admiro mucho a los arquitectos de guanajuato por el poder de dominar el color la catedral mas brillante que he visitado pero me impresiono mucho,Perú,espanol,PC,2016-12-15
masculino,53,internacional,Muy bueno,4,620,a fine church,the church is nicely illuminated in the evening and one can sit in a sidewalk cafe across the plaza gazing at its beauty the church has handsome lines and an attractive bell tower the interior has appealing structure and color scheme certainly representative of other grand mexican cathedrals worth a look,Canadá,ingles,PC,2016-12-15
masculino,25,internacional,Regular,3,51,baroque,heavily ornate church with spanish leanings yet has its own mexican influence in the finer details it is a small basilica so does not take long to see it,España,ingles,Móvil,2016-12-08
masculino,57,nacional,Excelente,5,97,stunning,all of my friends end up taking photos of this beautiful church a testament to the wealth guanajuato had for over 500 years,México,ingles,PC,2016-12-06
masculino,38,internacional,Muy bueno,4,197,hermosa iglesia,iglesia que esta cerca del sitio de mayor movimiento de la parte historica y cerca del teatro la forma de arquitectura de la iglesia es muy bonita,Brasil,portugues,Móvil,2016-11-30
femenino,33,internacional,Excelente,5,13,hermosa iglesia,la iglesia es muy bella de dia y de noche tambien tiene una gran iluminacion lo mejor es que la ubicacion que tiene es en una plaza encantadora parece que estas en europa,Guatemala,espanol,Móvil,2016-11-30
masculino,38,internacional,Muy bueno,4,582,picturesque,nice church in eye catching colors in the main center of town the inside is really nice as well was not expecting the level of graduate when i walked inside located in the middle of the action,Estados Unidos,ingles,Móvil,2016-11-27
femenino,63,internacional,Muy bueno,4,29,hermosa iglesia que emerge de color amarillo en la noche,inmediatamente iglesia notable entra en el guanajuato por la noche el exterior del reportaje tambien es impresionante pero el interior tambien es muy bonita el interior es las personas que se quedan en la estancia porque la impresion varia con el dia y la noche creo que ademas me gusta tambien la diferencia,Japón,japones,PC,2016-11-27
masculino,42,internacional,Muy bueno,4,751,muy bonita,especialmente por la noche vale la pena ir a tomar algunas fotos day tambien da buenos angulos nada q visita de 5 minutos,Brasil,portugues,PC,2016-11-25
masculino,60,internacional,Excelente,5,133,basilica,iglesia del siglo xvii enfrente de la plaza la paz contiene una escultura de la virgen patrona de la ciudad el interior de l aiglesia es impresionante con espectaculares lamparas venecianas,Venezuela,espanol,PC,2016-11-24
masculino,55,nacional,Excelente,5,14,icono de guanajuato,simbolo de guanajuato junto con el teatro juarez y la universidad de guanajuato de las principales edificios a visitar,México,espanol,PC,2016-11-23
femenino,24,nacional,Excelente,5,13,hermosa por dentro,la historia de esta basilica es increible y adentro esta hermosa vale la pena quedarse a escuchar la misa,México,espanol,PC,2016-11-21
femenino,56,nacional,Muy bueno,4,39,imprescindible en guanajuato,situada en el centro de la ciudad es un magnifico edificio el exterior destaca por su colorido y en el interior destacan los altares esta rodeada de restaurantes y de comercios por la noche esta iluminada y la zona tiene un gran encanto,México,espanol,PC,2016-11-20
masculino,60,internacional,Muy bueno,4,127,no exceda la catedral,vi una catedral la misa porque los creyentes mientras ve la misa era grande estar implicado en una persona apropiada dentro de la catedral yippeujiman ordenado una linea amarilla era una sensacion de calma,Corea del Sur,coreano,Móvil,2016-11-20
masculino,52,internacional,Muy bueno,4,684,la principal de guanajuato,esta basilica es la principal y mas colorista de la ciudad esta en el centro de la ciudad y es la preferida de los habitantes de esta ciudad iglesias la verdad que hay para todos los gustos y para tomar y dejar pero esta es la principal y los alrededores son pura vida,España,espanol,Móvil,2016-11-19
masculino,40,internacional,Excelente,5,82,basilica,maravilla mexicana guanajuato ciudad de contrastes y belleza exhuberante momnias gastronomia y mas disfrutaras en esta tierra,Colombia,espanol,PC,2016-11-18
masculino,36,internacional,Excelente,5,33,basilica of our lady of guanajuato,beautiful building inside and out it is positioned in the centre of the town many other local attractions are around the church banks shops restaurants and shopsinside it is beautiful and you can take pictures if you want to on the evening it is uluminated and we also used it as a great focal point for finding our way around the city in the early days,Costa Rica,ingles,PC,2016-11-15
femenino,41,internacional,Muy bueno,4,36,bonita iglesia,es una iglesia muy bonita que no puedes dejar de visitar si vas a guanajuato su arquitectura por fuera es austera pero por dentro te deslumbra se nota que es muy antigua pero esta muy bien conservada,Argentina,espanol,PC,2016-11-13
femenino,20,nacional,Excelente,5,67,muy bonita,es la iglesia que da el toque a la ciudad de guanajuato tanto por su ubicacion como arquitectura muy bonita imprescindible visitar,México,espanol,Móvil,2016-11-09
masculino,72,internacional,Excelente,5,238,major attraction,just enter sit down and enjoy the perfect ambiance of this church we stayed a full hour and emjoyed every minute,Estados Unidos,ingles,Móvil,2016-10-31
masculino,44,nacional,Excelente,5,63,hermosa catedral,una de las mas antiguas catedrales de mexico su ubicacion e incorporacion en el trazado de la ciudad ademas de sus bellos interiores la hacen visita obligada,México,espanol,PC,2016-10-26
femenino,27,nacional,Muy bueno,4,13,preciosa la basilica,es una muy buena opcion para visitar si vienes a guanajuato ya que es hermosa y mas si la vez de noche pues tiene una iluminacion escenica muy bonita,México,espanol,Móvil,2016-10-26
femenino,25,nacional,Excelente,5,128,center of everything,it has everything near by so if you get lost just ask for it and voil i came to the cervantino festival and it was packed all around but just get there by 1030ish am and u will be able to enjoy the church very well,México,ingles,Móvil,2016-10-22
masculino,67,nacional,Muy bueno,4,2,visiten tambien la galeria mariana de la basilica,la basilica es hermosa pero no ofrece mucha informacion al turista al lado en la antigua sacristia esta la recien renovada galeria mariana que subsana este deficit es un hermoso lugar con unos tesoros impresionantes esta abierta miercoles a domingo de 10 a 15 horas valdria la pena incorporarlo como atraccion pero se de guanajuato,México,espanol,Móvil,2016-10-20
masculino,33,nacional,Muy bueno,4,44,hermosa,es la tipica iglesia que esta en el corazon de la ciudad se alza majestuosa con su arquitectura que derrocha belleza y le da un toque precioso y nostalgico al lugar rodeado de cafes y comercios y edificios publicos que le acaban de dar un toque y realce especial,México,espanol,PC,2016-10-19
femenino,37,nacional,Excelente,5,43,santuario catolico historia viviente,esta basilica por si sola es impresionantemente hermosa por dentro obra de la arquitectura religiosa de la colonia es imposible entrar y no maravillarse por ella y disfrutar el tiempo que desees en un ambiente de paz y recogimiento interior,México,espanol,PC,2016-10-18
masculino,60,nacional,Muy bueno,4,600,an obligated visit in guanajuato,ive traveled around the world and have seen so many cathedrals and churches that it takes a really good one notre dame for example st pauls st patricks for me to write anything about anyone i recommend visiting it 2 times once during the day and another one at night at night it is lit up that gives the church and its surroundings a magical sense of unique beauty during the day it is beautiful bringing out its the vibrant colors as a tourist im sure youll love your visit to this cathedral,México,ingles,PC,2016-10-14
femenino,23,nacional,Muy bueno,4,8,otra opcion de iglesias en guanajuato,hermosa basilica accsesible llena de colorido e historia recordar siempre guardar silencio y tomar fotos sin el flash,México,espanol,Móvil,2016-10-04
masculino,44,internacional,Excelente,5,93,la catedral del estado,esta iglesia de gran tamano tiene en su interior arte sacro bello sin duda un punto turistico obligado,Estados Unidos,espanol,PC,2016-10-02
femenino,51,internacional,Regular,3,211,its quite amazing,its a beautiful church in the center of guanajuato it has beautiful architecture and its painted a bright color you can see it from high distances and its center in from of lots of little restaurants,Estados Unidos,ingles,Móvil,2016-09-28
femenino,39,internacional,Excelente,5,33,guanajuato pintoresca,guanajuato en todo su conjunto es una ciudad muy pintoresca todo tiene encanto hay un mundo de excursiones cercas y es realemnte un lagar digno de conocer,Chile,espanol,PC,2016-09-25
femenino,30,internacional,Excelente,5,532,loved it,i walked past this basilica a hundred times it was gorgeous and the layout of it and the area was so nicely done ive traveled around the world and have seen so many basilicas cathedrals and churches and this is one of the more unique ones first i highly recommend viewing this both during the day and night at night it is lit up and has a romantic feel to it during the day it is beautiful especially with the blue sky brings out the vibrant colors there always seemed to be something going on in andor around the church so be patient and enter when appropriate the inside was beautiful as well it was not over the top the square if you can call it that was very photogenic and beautiful you can walk around and get a lot of great views from the basilica overall you cannot miss this,Estados Unidos,ingles,PC,2016-09-21
masculino,42,nacional,Excelente,5,101,bendita misa,hermosa arquitectura fui a misa y me tome muchas fotos en el interior y el exterior y por cierto compre unos ricos tamalitos que vendes las monjas todo esta muy rico hay con ellas,México,espanol,PC,2016-09-18
femenino,31,internacional,Excelente,5,9,preciosa,esta en el centro de guanajuato al rededor de ella esta llena de lugares emblematicos llena de restaurantes y bares,Perú,espanol,Móvil,2016-09-16
femenino,53,nacional,Excelente,5,40,ubicacion y arquitectura privilegiada,en pleno centro de guanajuato con una arquitectura en el interior muy fina que se aprecia al maximo cuando esta iluminada durante una misa el organo muy antiguo y precioso,México,espanol,Móvil,2016-09-12
femenino,24,nacional,Excelente,5,25,hermosa arquitectura,no soy muy religiosa pero debo reconocer que esta iglesia es hermosa y vale la pena conocer te transporta a tiempos muy antiguos y la decoracion interior es esplendorosa definitivamente debes entrar a conocerla no te lleva mas de una hora esta rodeada de comercios cafeterias y de calles magnificas y tambien deben de verla desde el mirador el pipila se ve majestuosa,México,espanol,PC,2016-09-08
femenino,29,nacional,Muy bueno,4,10,muy linda,es muy pintoresca buena para tomarte fotos por afuera y por dentro solo que hay que ver los horarios de las misas para no interrumpir,México,espanol,PC,2016-09-06
masculino,22,nacional,Muy bueno,4,39,muy bonita muy cerca de la universidad de guanajuato,no soy religioso y aun asi esta iglesia es bien bonita frene a ella tienes cafes para sentarte en un dia de verano y disfrutar de una cerveza para hacer la pausa en tu camino despues puedes ir a tomar la foto en la universidad de gto y despues ir al teatro juarez,México,espanol,PC,2016-09-06
masculino,35,internacional,Excelente,5,25,hermoso color amarillo,una de las bellas cosas que ver en esta ciudad donde claramente nunca se aburrira durante mil cosas que ver,Italia,italiano,PC,2016-08-30
masculino,31,nacional,Excelente,5,53,a basilica with an interesting story,this basilica is gorgeous and well maintained the story of its towers is interesting and there is no need to get a tour to know that you can google it or search online when you are in the highest step of its entrance you have an amazing view of the plaza and of the streets,México,ingles,PC,2016-08-28
masculino,18,nacional,Muy bueno,4,22,colorida,una iglesia en el centro de guanajuato muy bonita por dentro y por fuera su ubicacion hace que siempre la veas un lugar obligado para sacarse una foto,México,espanol,PC,2016-08-23
femenino,46,internacional,Excelente,5,57,maravillosa,si viajas a guanajuato no puedes perderte esta visita es una iglesia maravillosa adems en mayo cada da hay una procesin y una serenata a la virgen por su mes,Argentina,espanol,PC,2016-08-11
femenino,23,internacional,Muy bueno,4,90,imponente,situada en una ciudad magicadonde cada callecita tiene algo en que detenerseesta basilica es bellisima por dentro y por fueravale la pena una parada en sus escaleras y observar lo que sucede en sus movidas calles,Perú,espanol,PC,2016-08-10
masculino,50,internacional,Excelente,5,47,beautiful basilica,i visited the basilica while walking down the street it is magical the ceilings the altar everything is beautiful,Estados Unidos,ingles,PC,2016-08-10
femenino,45,nacional,Muy bueno,4,352,maravillosa iglesia el corazon de guanajuato,iglesia tipica del bajio mexicano con elementos arquitectonicos sobrios pero monumentales sus nichos internos dedicados a diversos santos son notables asi como su altar y boveda central las misas son muy recomendables en esta iglesia por el grado de recogimiento que se muestra muy llena de turistas nacionales y extranjeros muy recomendable,México,espanol,PC,2016-08-09
femenino,68,nacional,Regular,3,162,muy bonita por fuerapor dentro nada espectacular,al ver la basilica por fuera imaginas que por dentro sera muy bonita con adornos y figuras espectacularesmentira no hay nada asi realmente es muy sencilla aunque no se pierde nada entrando,México,espanol,PC,2016-08-08
masculino,28,nacional,Muy bueno,4,108,normal hay mejores en otras ciudades,visita obligada es linda pero hay mejores en otras ciudades del estado de guanajuato los alrededores son muy lindos y sus colores hacen que salgan fotos excelentes,México,espanol,Móvil,2016-08-08
masculino,37,internacional,Muy bueno,4,141,linda,se encuentra al final de la calle principal muy bonita la basilica siendo uno de los pocos edificios tan alto en la ciudad,Venezuela,espanol,PC,2016-08-04
masculino,29,nacional,Muy bueno,4,245,pintoresca,la basilica es muy bonita y llena de vida aunque se pierde en el resto de las actividades a su alrededor,México,espanol,PC,2016-08-01
femenino,26,internacional,Muy bueno,4,67,gran lugar de la foto,gran para la fotografia que se encuentra en el centro de guanajuato buena luz toda la arquitectura de estilo espanol se puede colocar en el cristalino del tambien es uno en el que el centro de la ciudad plaza de la paz vale la pena una visita,Corea del Sur,chino,PC,2016-07-31
femenino,34,nacional,Excelente,5,9,boda maravillosa,fuimos a la boda de una familiar y fue una experiencia familiar inolvidable valio la pena asistir desde tan lejos a reunirnos,México,espanol,PC,2016-07-29
masculino,74,internacional,Muy bueno,4,453,a very beautiful basilica,it is beautiful on the outside and stunning on the inside a truly magnificent altar a lot of silver used here which is fitting considering you are in guanajuato a huge silver play during the spanish colonial time and still today we went to a service mass and listened to a magnificent choir during mass the church is a must see in guanajuato it is also awesome in the evening with the light playing on the outside,Estados Unidos,ingles,PC,2016-07-27
masculino,59,nacional,Excelente,5,58,imponente,es un recinto religioso sencillamente fascinante si visitas guanajuato no puedes dejar de conocerla,México,espanol,PC,2016-07-25
masculino,23,internacional,Excelente,5,18,beautiful church well maintained,absolutely beautiful surrounded by shops cafes etc if you are going to mass get there early sound could be improved,Estados Unidos,ingles,PC,2016-07-22
femenino,19,nacional,Muy bueno,4,46,arquitectura,muy bonito lugar con una buena vista la gente amablemente el lugar limpio buen lugar para tomar fotografias,México,espanol,PC,2016-07-22
masculino,55,internacional,Muy bueno,4,58,interesting place,one of the tourist object at guanajuato is the lady of guanajuato basilica the color of basilica were representatif of the woman,Indonesia,ingles,PC,2016-07-20
femenino,63,internacional,Regular,3,517,cant miss it,you cant really miss the basilica as it in the middle of town and since you are there you might as well check it out it is well done and interesting but not spectacular,Australia,ingles,PC,2016-07-14
femenino,53,internacional,Excelente,5,7,colonial,muy colonial imagenes con tallados sencillos pero hermosos da una sensacion de paz el altar mayor es lo mas relevante,Panamá,espanol,PC,2016-07-12
masculino,35,internacional,Muy bueno,4,51,nice place to visit while you are walking in guanajuato,not the nicest cathedral in mexico but worth to see if you are walking around guanajuato for trip picture lovers you have to take your picture outside the cathedral this is classic one of your trip to guanajuato,Estados Unidos,ingles,PC,2016-07-10
femenino,49,internacional,Muy bueno,4,2973,iglesia de color amarillo brillante,ciudad colonial la linea roja en la gran iglesia de color amarillo brillante viva parece guanajuato se ve hermosa iglesia visible la atencion incluso de las colinas de pipila,Japón,japones,PC,2016-07-03
femenino,50,internacional,Muy bueno,4,1858,lovely colonial architecture,the whole city of guanajuato is very colourful and cheerful to look at and the basilica adds up to the overall atmosphere lovely both from the inside and outside it is one of the places surely to visit in guanajuato,Rusia,ingles,PC,2016-07-03
masculino,58,internacional,Muy bueno,4,89,otra iglesia mexicana,mexico tiene iglesias maravillosas e inolvidables como la catedral de ciudad de mexico el templo de atotonilco parece que la capilla sixtina la capilla del rosario en puebla la gente del lugar considerar la octava maravilla del mundoo y no deben estar equivocado la parroquia de san miguel de allende el coloridissima santa maria de tonantzintla cholula el templo de santo domingo en oaxaca esto es solo una mas bella pero nada del otro mundo vale la pena una imagen de la virgen sobre un solido pedestal de plata y algunas otras esculturas en su interior no estoy diciendo que es feo pero no llega a los pies de las iglesias mas hermosas que he visto en el pais,Brasil,portugues,PC,2016-07-02
femenino,54,nacional,Excelente,5,4,nuestra boda de ensueno,nuestra boda se efectuo en la basilica de guanajuato el pasado 28 de mayo fue maravilloso el templo las luces la emocion de la gente inclusive de los turistas que estaban visitandola es una hermosa opcion para una boda,México,espanol,PC,2016-06-30
masculino,32,internacional,Regular,3,65,normal,es una iglesia mas turisticamente hablando no obstante en las noches con su iluminacion le da un toque magico y divertido al centro y sus calles,Colombia,espanol,Móvil,2016-06-28
femenino,66,internacional,Excelente,5,117,cuando bella por dentro a diferencia de aspecto aparentemente sencilla,el exterior de guanajuato es simple pero a diferencia del gran teatro junto a la catedral de la catedral situada en el zocalo mira este agradable y un interior precioso lugar ver mira hacia abajo desde la catedral tambien pacifica,Corea del Norte,coreano,PC,2016-06-25
femenino,24,internacional,Excelente,5,51,emblematica,es una basilica hermosa que encaja a la perfeccion con el paisaje pintoresco de guanajuato tanto de dia como de noche de cerca o desde el mirador es una construccion digna de admirar,Ecuador,espanol,Móvil,2016-06-23
masculino,37,nacional,Excelente,5,133,basilica de guanajuato,hermosa como toda basilica sin lugar a duda su arte barroco es impresionante por fuera y por dentro es imponente y de noche parece que fuere un edificio hecho de oro con una iluminacion que la hace ver de ensueno es una lugar que en el centro de guanajuato debe visitar forzosamente y dar gracias al creador aqui les dejo unas foto por la noche en nuestra camino a la trattoria de elena para cenar,México,espanol,PC,2016-06-20
femenino,30,nacional,Muy bueno,4,29,belleza arquitectonica,sus cavados soy muy peculiares por dentro es una belleza su singular torre de campana la cupula permite el eco de los sonidos sin necesidad de microfono se escucha muy bien la voz,México,espanol,PC,2016-06-16
femenino,48,internacional,Excelente,5,651,visually striking inside and out,originally constructed in 1671 is on the plaza de la paz at the heart of guanajuato both centrally histoeically and religiously nuestra senora de guanajuato or guanajuato basilica is both the most visually striking and historically important the exterior is painted a powerful shade of yellow with red wine detail and doome roofed the main portal is surrounded by a pink sandstone formation of steeped layers with carvings of the saints it is positioned on a slight hill which makes the basilica stands higher than the surrounding buildings inside the basilica is jewel encrusted image of the virgin mary great photo opportunity day or at night when its illuminated,Estados Unidos,ingles,Móvil,2016-06-11
femenino,52,internacional,Muy bueno,4,326,barroca,hermoso e imponente edificio barroco en el centro historico justo al llegar habia un servicio funebre igual nos dejaron pasar,Argentina,espanol,PC,2016-06-08
femenino,25,nacional,Excelente,5,38,bonita,es un lugar emblematico de la ciudad de guanajuato cerca de esta iglesia se concentran los mejores restaurantes y tiendas,México,espanol,PC,2016-06-06
masculino,30,nacional,Muy bueno,4,118,hermosa de noche,se encuentra en el centro de la ciudad muy cerca de los lugares concurridos en la noche no es dificil llegar a ella y por dentro es pintoresca lo bueno es en la noche ya que con la iluminacion se ve fabulosa,México,espanol,PC,2016-06-02
masculino,33,nacional,Excelente,5,115,en el corazon de guanajuato,esta en el centro de guanajuato es simplemente una obra muy hermosa y colorida para visitar a lado tiene un museo su tamano es muy grande y de noche se lllenan de luces,México,espanol,PC,2016-06-01
masculino,69,internacional,Muy bueno,4,27,day of the flowers,i was in guanajuato when the whole city was celebrating the day of the flowers it was very very crowdy and very hot but we still discovered some nice places in the centrum i really loved the colored houses and the small streets,Estados Unidos,ingles,PC,2016-05-22
masculino,44,nacional,Regular,3,73,genial el museo que esta a un lado,las iglesia de real de minas son hermosas por fuera pero por dentro a mi me han dejado mucho que desear cuando mas son majestuosas en tamano pero esta iglesia en particular tiene un pequeno museo a un lado ostenta un retablo perfectamente limpio y con una iluminacion exacta,México,espanol,Móvil,2016-05-19
masculino,32,nacional,Excelente,5,25,el icono de la ciudad,es el centro focal de la ciudad ya sea por referencia o si estas viendo desde el mirador todos se refieren a ella como punto de partida sus colores son bonitos y la vista de la ciudad saliendo de la iglesia me hicieron sentir como en un parque tematico,México,espanol,PC,2016-05-18
masculino,31,nacional,Excelente,5,44,muy bella,si vienes a guanajuato tienes que visitar la basilica esta muy bonita muy limpia y muy bien conservada vale la pena entrar,México,espanol,PC,2016-05-09
masculino,41,nacional,Excelente,5,30,un templo muy bello,si vienes a guanajuato es un lugar que debes de visitar esta muy bonito adema que esta en el mero centro de la ciudad,México,espanol,PC,2016-05-03
masculino,64,internacional,Excelente,5,143,beautiful basilica the pride of guanajuato,a lovely basilica that makes for a great photo at night at about 2010 the outside lights of the basilica came on and made it look even more beautiful another great viewpoint is from the top of the funicular rail high above the city,Inglaterra,ingles,PC,2016-05-03
masculino,45,nacional,Muy bueno,4,537,vale la pena,vale la pena pasar por el lugar y visitarlo en el mero centro de la ciudad centro historico y enfrente los escalones para estar sentados,México,espanol,PC,2016-04-29
masculino,29,nacional,Excelente,5,17,excelente,camine desde un lugar atras de esta basilica hasta la alhondiga y fue muy relajante y hermoso guanajuato es hermoso y muy limpio,México,espanol,PC,2016-04-28
femenino,30,nacional,Excelente,5,24,visita que no puede faltar,me gusta que a pesar de muchas visitas lo mantengan en buen estado en la entrada puedes encontrar grupos de estudiantinas que inmediatamente te envuelven con sus canciones para tener una experiencia unica,México,espanol,Móvil,2016-04-27
masculino,67,nacional,Excelente,5,99,templo catolico bellisimo,se ubica en el centro de la ciudad de guanajuato y es muy conveniente visitarla y admirar el edificio y las hermosas imagenes que se encuentran en su interior para la veneracion de los fieles templo hermoso adecuado para bodas o aniversarios,México,espanol,PC,2016-04-27
