Genero,Edad,Procedencia,Calificacion,Score,Aportaciones,Titulo,Opinion,Pais,Idioma,Dispositivo,Fecha
femenino,64,internacional,Muy bueno,4,175,punto central,basilica muy bien conservada punto central en la ciudad muy linda por dentro vale la pena darse una vuelta para conocer alto significado religioso y arquitectonico,Colombia,espanol,Móvil,2018-05-13
masculino,59,internacional,Excelente,5,306,the most important church in this colonial town full of history,the basilica guanajuato does not have a cathedral it is situated in the nearby city of leon is truly imposing both during the day and when illuminated at night it also has some lovely polychrome sculpture and a great organ,Colombia,ingles,PC,2018-05-08
femenino,26,internacional,Excelente,5,106,y uno de los simbolos de guanajuato,edificio de la iglesia amarilla es un abigarrado y nahu crear una mas bella de atocha he venido a cabo mejor en frente de la misma guanajuato es menor cuando se toman fotografias que gabolman menos una,Corea del Sur,coreano,PC,2018-05-05
masculino,50,internacional,Excelente,5,62,beautiful and a must see,a must see place in town and very nice to go inside and beautiful outside to take pics in the center of town,Estados Unidos,ingles,PC,2018-05-01
femenino,55,internacional,Regular,3,59,nice,not particularly impressive but if you like historic buildings of any type this is worth a walkin,Estados Unidos,ingles,PC,2018-04-29
femenino,57,internacional,Muy bueno,4,578,beautiful church especially at night,wandered into the church on a sunday evening during mass the lovely chandeliers were alit and looked beautiful the outside is also lighted at night and though not huge it certainly looms over the plaza,Estados Unidos,ingles,PC,2018-04-23
masculino,33,internacional,Excelente,5,112,beautiful inside and out,this is clearly the center piece of the city and its gorgeous go inside and enjoy the art if there is a mass going on please be respectful and avoid flash,Estados Unidos,ingles,Móvil,2018-04-18
masculino,64,internacional,Muy bueno,4,491,beautiful church town centerpiece,seems like on a visit to guanajuato you pass by or see this beautiful church wherever you go great view of the outside from down the street beautiful inside too pretty much a required stop in your visit to this city and for good reason,Estados Unidos,ingles,Móvil,2018-04-17
masculino,24,nacional,Excelente,5,37,hermoso lugar,muy pintoresco la basilica se ve desde el mirador tambien es una ciudad magnifica no se pierdan el elote asado en los carritos del costado,México,espanol,PC,2018-04-16
masculino,38,internacional,Excelente,5,58,coolest city in mexico,i was in irapuato on business and my colleague suggested we visit guanajuato i have to say this is the coolest city ive been to in all of mexico from the small european style streets to the underground tunnelstreets and sidewalk cafesand dont forget the beautiful architecture and theres an amazing vineyard camino d vinos just a few miles from town i hope to return on vacation with my wife,Estados Unidos,ingles,PC,2018-04-03
femenino,27,nacional,Excelente,5,13,muy bonita,el sitio por dentro esta realmente precioso nos toco una misa donde por suerte tocaron el organo y mejoro mucho la experiencia vale la pena visitar es de las iglesias mas bonitas que he visitado,México,espanol,Móvil,2018-03-29
masculino,51,internacional,Excelente,5,213,a fine piece of history,what a beautiful peaceful church it is centrally located and an easy walk from all locations walk into the church and feel the historical past sit and just enjoy the quietness of the building,Canadá,ingles,Móvil,2018-03-24
masculino,35,nacional,Excelente,5,159,excelente mantenimiento,es increible encontrar una basilica con siglos de antiguedad y con un mantenimiento impecable vale la pena visitarla sin duda,México,espanol,PC,2018-03-21
femenino,40,internacional,Excelente,5,11,hermosa ejemplo de nustra religion y cultura,hermosa arquitectura recuerdo de nuestros antepasados puedes orar a cualquier hora del dia y cuando estas ahi te siente lleno de paz y de noche con una vista hermosa en el centro de guanajuato,Estados Unidos,espanol,PC,2018-03-19
femenino,32,internacional,Excelente,5,15,magnifico monumento imposible,guanajuato y sus monumentos son una necesidad es hermoso todo es para ver se necesitan al menos 4 dias para ver todo a fondo,Francia,frances,PC,2018-03-19
masculino,71,internacional,Excelente,5,323,toprate for a cathedral,im not a big cathedral person and it is easy to tire of them in latin america like you get tired of wats temples but the yellow city cathedral of guanajuato is easy on the eyes from the outside in fact from the hill of pipila it jumps right out of the cityscape inside during the midday sunday mass the chandeliers were all lit up setting off the beautiful cream and yellow colors making the place all cheerful and lit up in contrast to so many of the usual dark interiors,Estados Unidos,ingles,Móvil,2018-03-18
masculino,25,internacional,Excelente,5,56,dont miss the virgin older than 1300 years,the basilica is highly visible from any vantage point in the town including the mirador the plaza is called the plaza de la paz the peace plaza and there is a plate that indicated the basilica and centre of town are unesco patrimony of humanity since 1957 of course the real treat is the interior of the church our lady of guanajuato is a sculpture of the virgen mary on the altar of this church and is the oldest virgin in the americas it was sculpted in andalucia and when invaded by the arabs in 714 the catholics hid the image in a humid cave for 8 centuries until 1557 when felipe ii made a gift of the virgen to the town of guanajuato because of the vast riches that the town had sent back to spain so that makes the virgin older than 1300 years and well worth a peek the virgin is about 115 meters in cedar and originally had a rose in one hand later a sceptre and a crown until a rose was replaced again the 8th of august is the festival of the virgin the mining expansion occurred throughout the 17th century and guanajuato was one of the grandest mines in all the americas the new spain in those days which explained why the king and his son made the gift to the town,Estados Unidos,ingles,PC,2018-03-16
masculino,20,nacional,Muy bueno,4,92,muy bonita,coloreando un punto imperdible del centro de la ciudad y con una arquitectura y un diseno muy maravillosos no deja de ser un templo y tal vez no resulte muy interesante si no gustan de la arquitectura o la historia,México,espanol,PC,2018-03-12
femenino,48,nacional,Muy bueno,4,22,una linda iglesia,una iglesia muy tradicional y muy bella como varias que hay en guanajuato muchos anos de antiguedad,México,espanol,Móvil,2018-03-09
masculino,36,internacional,Muy bueno,4,148,llamativo color amarillo catedral del siglo xvii un poco sosa decoracion de estilo griego o romano,guanajuato esta situado justo en el centro alto llamativo no importa en que direccion ir se puede utilizar como un objetivo y no perderse aspecto es hermoso color caqui y ladrillo rojo el interior de la iglesia era delicada blanco amarillo ganso estilo griego romano tambien se repiten decoracion del techo y murales pero son empujadas blanco simple geometrica en lugar de generales rococo espana se acompana de un gran numero de modelo del rizo apariencia dorada de lujo cada 15 minutos la campana pero el numero de bell es independiente del tiempo hay un monton de restaurantes tiendas de recuerdos es adecuado en las proximidades de los demas iglesia en el lado izquierdo de la carretera por la universidad de guanajuato hay una parada de autobus a la parada de autobus el coche puede estar aqui y asi sucesivamente,Taiwán,chino,PC,2018-03-07
masculino,26,internacional,Regular,3,2562,sin gracia,me esperaba mas para tener una reputacion de lugar historico pero la historia tiene muitoe para los religiosos que no es una perdida de tiempo,Brasil,portugues,Móvil,2018-03-01
masculino,41,internacional,Regular,3,214,iglesia famosa en guanajuato,es una famosa iglesia en guanajuato la noche es bella y se encienden en las inmediaciones de la universidad de guanajuato hay estudiantes japoneses ven lo que se recomienda quedarse,Japón,japones,Móvil,2018-02-24
masculino,63,internacional,Muy bueno,4,844,beautiful details,this basilica is one of the main catholic temples of the city is very large with many beautiful details at the interior you can appreciate lots of decoration at the ceilings and dome there is a very nice musical organ a recommended visit while in guanajuato to appreciate the architecture and religiosity of the city must see at night from the exterior and interior beautiful illumination,Guatemala,ingles,PC,2018-02-22
femenino,36,nacional,Muy bueno,4,83,hermosa estructura en pleno centro de la ciudad,en el corazon del centro de la ciudad hermosa basilica digna de unas buenas fotografias desde ahi se puede ir facilmente caminando a la mayoria de los lugares importantes del centro,México,espanol,PC,2018-02-21
femenino,69,internacional,Excelente,5,757,lovely,the basilica of our lady of guanajuato is magnificent it is worth your time to go inside for a visit there is no charge,Canadá,ingles,Móvil,2018-02-17
masculino,29,internacional,Excelente,5,93,beautiful must see in guanajuato,part of any walking tour in guanajuato well conserved totally worth it located just meters from the main square el jardin,Chile,ingles,Móvil,2018-02-15
femenino,33,internacional,Excelente,5,62,iglesia central,la iglesia es hermosa como todo el mundo dice pero lo que he encontrado un medio interesante es que esta en una plaza donde los mexicanos hacen eventos para la gente de la ciudad fue el dia 04 noviembre todavia estaban celebrando el dia de los muertos con una seleccion de catrinas musica orquestal canciones y bailes populares muy bueno,Italia,italiano,Móvil,2018-02-08
masculino,31,nacional,Excelente,5,51,hermosa arquitectura e interior,retablos y nave decorada candelabros al estilo barroco angeles por donde sea detalles en pinturas arte bien conservado,México,espanol,Móvil,2018-02-05
masculino,45,internacional,Regular,3,326,basilica in the centro,this is a location you will walk by while walking in the city every mexican city or town has a church due to the silver wealth of the city it is a basilica in the parochial style the church is filled with people during the day and it really is up to you and how you feel about visiting churches whether you want to stop inside or just observe the architecture from the exterior,Estados Unidos,ingles,PC,2018-01-29
femenino,32,internacional,Excelente,5,63,impresionante iglesia con colores vibrantes,iglesia en la plaza central de guanajuato con un color amarillo que se destaca en la calle el interior es impresionante con una decoracion que nos deja deslumbrados techos altos pintados y lamparas de cristal reluciente lleno de luz donde la mayoria de las mujeres eligen para casarse por lo que lo mas probable es ir alli y ver a una novia para casarse y se sorprendera,Portugal,portugues,Móvil,2018-01-28
masculino,49,internacional,Muy bueno,4,3280,central y amarillo,la gran arquitectura religiosa en el centro de la ciudad con vistas a la plaza de la paz muy bonito por la noche cuando esta iluminado con luces blancas el suntuoso interior no es particularmente memorable obras si no el magnifico organo para visitar absolutamente,Italia,italiano,PC,2018-01-25
femenino,34,nacional,Muy bueno,4,16,lindo lugar,la iglesia es bonita y tiene los restos de una martir interesante leer su historia y saber por que estan ahi,México,espanol,Móvil,2018-01-22
masculino,20,nacional,Excelente,5,11,inicio turistico,al llegar a la basilicapuedes decidir irte hacia el mercado o hacia el teatro o puedes detener a desayunar o tomar alguna bebida enfrente ya que tien 2 restaurantes en la calledonde se disfruta el andar de las personas que disfrutan guanajuatocaminando y el templo de dia luce por su majestuosidad y localizacionaunque no lo recominedo para personas que tengan problemas de caminar o de carreolasporque hay que subir bastantes escalones pero ya dentro tien una presentacion digna de un palacio espiritual ademas que tiene una gran historia de la sociedad guanajuatense y de la historia de la ciudad,México,espanol,PC,2018-01-22
masculino,51,internacional,Regular,3,521,its a church what can you say,every town of any size in mexico seems to have a parochial style of church some are better like san miguel de allendes some not as good like dolores hidalgos this follows the formula if youre into churches particularly of this architectural style then its worth a visit otherwise id give it a miss look at it from the outside or from up at the pipila viewpoint but its not worth going inside,España,ingles,PC,2018-01-14
masculino,30,internacional,Muy bueno,4,22,beautiful church,this church is beautiful from the outside and the inside it is very recommended to pass by for a few minutes and take some pictures,Egipto,ingles,Móvil,2018-01-13
masculino,25,internacional,Regular,3,56,las atracciones del centro de visita obligada,iglesia en el centro de la ciudad siempre y cuando este en guanajuato que pasara a traves de esta iglesia iglesia de puertas abiertas gratuita fui a solo tienen algunos rituales durante el dia en el exterior se puede tomar muy buenas fotos,Taiwán,chino,PC,2018-01-10
femenino,22,nacional,Muy bueno,4,17,hermosa,es el templo mas importante de guanajuato y es un lugar turistico hermoso que todo aquel que vaya a esta ciudad debe conocer,México,espanol,PC,2018-01-08
masculino,71,internacional,Muy bueno,4,947,preciosa basilica,se visita la basilica de notre senora de guanajuato como en otros lugares es el corazon de la ciudad este edificio amarillo imponente es el centro de la ciudad habiamos querido visitar el dia antes pero estabamos celebrando una boda hoy en dia tenemos sonidos lugar entre los bautismos y comuniones justo antes aprovechamos el interludio para ver y al mismo tiempo ver a un hombre joven que hace pivotar para tirar de un cable para operar las campanas impresionante,Canadá,frances,PC,2018-01-06
femenino,37,nacional,Muy bueno,4,23,basilica de guanajuato,la basilica colegiata de nuestra senora de guanajuato es el edificio mas protagonista de la plaza de la paz se le denomino parroquia de guanajuato hasta el ano de 1957 en que se le elevo a la categoria de la basilica de nuestra senora de guanajuato su construccion se inicio en el ano de 1771 y se concluyo en 1796 los mineros fueron quienes cubrieron los costos del lugar en ese ano se llevo al templo la imagen de la virgen de guanajuato la cual dice la tradicion fue donada por el rey felipe ii es una magnifica escultura en madera estofada llama la atencion la dulce belleza de los rostros de la virgen y el nino y tiene una rica base de plata repujada de estilo barroco su arquitectura corresponde al barroco manierista del siglo xvii con esbelta cupula del mismo estilo su atrio data de principios del siglo xix cada una de sus tres puertas de acceso tiene una fachada en cantera rosa sobresaliendo la fachada principal sobre la cual se erige el campanario de tres cuerpos de la misma epoca y estilo ademas del cubo del reloj se aprecia otra torre de inferiores proporciones y de bello estilo churrigueresco del siglo xviii en el altar mayor se encuentran los autenticos restos de santa faustina martir y su sangre en polvo contenida en un bello vaso los cuales fueron adquiridos en roma por el segundo conde de valenciana,México,espanol,Móvil,2018-01-06
masculino,41,nacional,Regular,3,47,not bad not the best,if you liked parochial architecture youll enjoy the basilica but i did not find it particularly nice worth a visit though,México,ingles,Móvil,2018-01-05
femenino,37,nacional,Excelente,5,148,hermoso templo,con tantas iglesias como hay en guanajuato es dificil competir sin embargo esta basilica es hermosa,México,espanol,Móvil,2018-01-05
femenino,18,nacional,Excelente,5,63,templo emblematico en el centro de guanajuato,entre todas las iglesias que se encuentran en esta ciudad sin lugar a dudas resalta la basilica con detalles en su interior y en si fachada de alto relieve muy cuidada y donde podras celebrar alguna ceremonia importante en tu vida cuando la visite nos toco la suerte de presenciar una boda y para recibir el ano nuevo frente a ella el gobierno de la ciudad monta un escenario y de ella lanzan fuegos pirotecnicos muy recomendable,México,espanol,Móvil,2018-01-04
masculino,72,internacional,Excelente,5,15,beautiful city beautiful basilica,the strikingly beautiful basilica is just one of the marvelous sites in guanajuato it is located just down the street from the central park there are lots to see in this historic city and the basilica is one of many must see places,Estados Unidos,ingles,PC,2018-01-04
masculino,24,internacional,Excelente,5,41,imponente,asentada en el centro de la ciudad su arquitectura es imponente vistiendo totalmente la plaza de la paz es un lugar obligado para su visita la tipica foto cayendo la tarde no puede faltar en su interior se pueden apreciar el arte y estructura imponentes,Argentina,espanol,Móvil,2017-12-27
femenino,36,nacional,Excelente,5,80,hermosa,me toco verla de dia y de noche en la noche le iluminen por fuera y se ve super bonita es color amarillo mostaza y hace muy bonito contraste con el azul del cielo vale la pena darse una vuelta aunque no se profese la religion catolica por fuera hay jovenes vestidos de estudiantina que te ofrecen callejoneadas en la noche,México,espanol,Móvil,2017-12-26
masculino,39,internacional,Muy bueno,4,567,notable,la basilica de nuestra senora de guanajuato tiene una imagen de la virgen patrona de la ciudad todo cubierto de joyas y se encuentra en la plaza de la paz no hay que perderse,Italia,italiano,PC,2017-12-22
masculino,61,internacional,Excelente,5,107,es un templo magnifico en pleno centro historico de guanajuato,imponente templo en el nucleo historico de guanajuato reliquia colonial que no debes dejar de visitar por su riqueza religiosa y arquitectonica,Perú,espanol,PC,2017-12-22
masculino,49,internacional,Excelente,5,940,from the outside the color and architecture are top notch pristine and well maintained,it seemed like every time i tried poking my head in this church as i walked by there was a service going on this specific friday i finally went inside during the service at night when it was all lit up it was stunning i recommend a visit,Estados Unidos,ingles,PC,2017-12-16
femenino,21,internacional,Excelente,5,66,justwow,the sites of this quaint city are so breathtaking basilica of our lady of guanajuato included i recommend coming into the city of guanajuato during the day and staying to see the sites in the evening so you get to experience the best of both worlds be sure to wear comfortable shoes to help navigate the cobblestone streets,Estados Unidos,ingles,PC,2017-12-11
femenino,44,nacional,Excelente,5,6,hermosa,simplemente si vas a guanajuato tienes que visitarla para tu acervo cultural arquitectura inigualable,México,espanol,Móvil,2017-12-09
femenino,22,internacional,Excelente,5,39,gorgeous place,absolutely stunning on the inside was open every time we walked by it is located in the center of everything just a short walk away from teatro juarez,Estados Unidos,ingles,PC,2017-12-06
masculino,26,nacional,Muy bueno,4,154,visita a la basilica,visita obligada es un lugar al que tienes q ir la infraestructura de la basilica es espectacular la parte de adentro cuenta con un detalle muy bueno es un lugar que puedes visitar a cualquier hora en la noche la iluminacion en la noche es increible,México,espanol,PC,2017-12-01
masculino,34,nacional,Excelente,5,41,no puedes perderte una foto aqui,en la noche se ve muy bonita la iglesia con la iluminacion que le ponen imperdible para sacar una foto,México,espanol,PC,2017-11-24
femenino,38,nacional,Excelente,5,155,casi la catedral,cerca del jardin union encontraras este lugar emblematico y su arquitectura tipo barrocon con oro de las minas aunque es la capital de guanajuato deberia ser cate dral aunque no quisieron una visita obligada y agradable,México,espanol,Móvil,2017-11-21
masculino,27,nacional,Excelente,5,12,una de las varias hermosas iglesias de guanajuato,fue la primer iglesia que visitamos por nuestro recorrido de la ciudad y fue la primer impresion de la majestuosidad de la arquitectura de la ciudad esta hermosa y definitivamente si vas a la ciudad te recomiendo visitarla,México,espanol,PC,2017-11-14
masculino,42,nacional,Excelente,5,13,la mejor,es perfecta y muy agradable es imponente y llamativa a sus alrededores podras encontrar restaurantes se encuentra en una via caminable recomiendo recorrer toda la zona y visitarla por dentro es hermosa,Chile,espanol,PC,2017-11-13
masculino,69,internacional,Excelente,5,925,aspecto colorido y hermoso de la iglesia,la iglesia se encuentra en el centro de la ciudad delante de la iglesia se ha convertido en una plaza con una fuente que los ciudadanos ikoi alrededor de que hay muchas opiniones que haya un asiento terraza del restaurante orquesta y la noche es alli ha jugado el mariachi tambien durante el dia es hermoso y colorido pero su apariencia es tambien preciosa para ser iluminado por la noche,Japón,japones,PC,2017-11-13
masculino,52,internacional,Excelente,5,223,muy muy hermosa basilica,sin comentarios guanajuato tiene iglesias visitar hermosas y bellas basilicas pero es realmente muy hermosa vale la pena el viaje,Francia,frances,Móvil,2017-11-11
femenino,43,nacional,Excelente,5,18,beautiful colonial church,as many of the churches in guanajuato city this temple is beautiful a great architectural visit it is a must see,México,ingles,PC,2017-10-26
femenino,63,internacional,Excelente,5,432,walk inside turn around and look up,almost everything has gold leaf on it including the huge pipe organ in the balcony in the back of the church eye popping the church of our lady of guanajuato became the basilica in 1957 when a bishop came the building title upgrade reflected the title of the new head of the church the facade is manneristbaroque in style the sculpture of the virgin of guanajuato the citys patron was a gift from king carlos v of spain in 1557 this is a mustsee when youre in town oh one more thing we had a chance to talk with the bellringer when we left there is no pattern he rings the bell as many times as the spirit moves him,Estados Unidos,ingles,PC,2017-10-25
femenino,66,internacional,Excelente,5,174,beautiful basilica,this basilica is really beautiful and it is a mustsee in guanajuato walk around the downtown and dont forget to stop here and take a look inside since it has amazing architecture inside too,Finlandia,ingles,PC,2017-10-23
femenino,29,internacional,Excelente,5,58,medio dia en guanajuato,inicie mi dia a las 4pm y lo termine a las 1130pm que se puede decir de esta ciudad un cuento sus callejones la historia y todos los edificios arquitectonicos los cuales son la tradicion e historia de una pueblo que peleo por su independencia la basilica de nuestra senora de guanajuato es un excelente lugar para escuchar parte de la historia afuera hay ciudados que te cuentan la historia por unos cuantos pesos o unas tortas vale la pena escucharlos si no tienes un guia turistico,Israel,espanol,Móvil,2017-10-17
masculino,21,nacional,Excelente,5,445,la mejor de guanajuato,la basilica de nuestra senora de guanajuato es la mejor o una de las mejores obras barrocas en guanajuato la arquitectura es impresionante pero por dentro es magnifica definitivamente es un tienes que ver de guanajuato,México,espanol,Móvil,2017-10-16
femenino,33,internacional,Excelente,5,24,basilica of our lady of guanajuato,this is just one of several churches in guanajuato and each one is spectacular to go into view and take photos the architecture and workmanship is stunning look up and all around in one church there was a magnificent pipe organ it looked as though there was a rehearsal in progress as a man was playing it while a woman sang it was quite beautiful bit be respectful and aware it might be a rare occurrence but we walked in unaware during a funeral it wasnt until they proceeded down the aisle with the casket that we knew at this time we moved outside and then left to come back later,Canadá,ingles,PC,2017-10-05
masculino,42,nacional,Excelente,5,47,basilica en el centro de la ciudad,ermosa basilica localizada al centro de la ciudad cerca de otros atractivos turisticos muy bien cuidada,México,espanol,PC,2017-10-03
masculino,36,nacional,Muy bueno,4,41,iglesia mas emblematica de la ciudad,hermosa basilica en el mero centro de guanajuato frente a la plaza de la paz con un estilo barroco y neoclasico cuenta con la primera escultura de la virgen llegada a america en una bella pieza de madera de cedro,México,espanol,PC,2017-10-02
masculino,68,internacional,Excelente,5,926,beautifuk inside and out,this basilica is one of the most beautiful that i have seen in mexico its decoration inside is subtle but elegant it is a peaceful break from all your walking around the city,España,ingles,PC,2017-09-18
masculino,50,nacional,Muy bueno,4,87,emotional and inspirational,the architecture of the churches are simply outstandingthe details of the ceiling painted and statues are very well defined,México,ingles,PC,2017-09-13
femenino,41,nacional,Excelente,5,65,preciosa,es tan hermosa en su interior y se celebran las mejores ceremonias eclesiasticas de la sociedad ademas del tinte religioso como historia y arquitectura vale en todo,México,espanol,PC,2017-09-12
masculino,74,internacional,Excelente,5,546,el aspecto hermoso,en particular una gran vista nocturna desde la cima de la colina en la iglesia simbolica de guanajuato ubicada en el centro de la ciudad usted puede disfrutar de la vista durante el dia y la noche,Japón,japones,PC,2017-09-08
